,id,conversation_id,date,username,tweet_processed,hashtags,tweet_original,target
1269,1079814271096242176,1079814271096242176,2018-12-31,incupunk,I'm serious.. Sometimes you just need a friend..    pic.twitter.com/Ng7ApLxweJ,"['#beafriend', '#depression']",I'm serious.. Sometimes you just need a friend.. #beafriend #depression  pic.twitter.com/Ng7ApLxweJ,1
1277,1079811147254108160,1079811144850833410,2018-12-31,beastmorphersx,So far my  goals is to return to the  with a new membership to start working off not only my  but getting myself in shape. This also means that I need to start eating more healthier as well.,"['#january2019', '#ymca', '#depression']",So far my #January2019 goals is to return to the #YMCA with a new membership to start working off not only my #depression but getting myself in shape. This also means that I need to start eating more healthier as well.,1
1285,1079807093778120706,1079807093778120706,2018-12-31,beastmorphersx,As  comes closer to a close I want to continue to look forward to the future rather then live in the past like I have been for years due to my huge guilt over past actions including  attempt and .,"['#lastdayof2018', '#suicide', '#depression']",As #LastDayof2018 comes closer to a close I want to continue to look forward to the future rather then live in the past like I have been for years due to my huge guilt over past actions including #suicide attempt and #depression.,1
1290,1079806596925001728,1079806596925001728,2018-12-31,gedankengewitte,Fick Dich 2018!  2019 wird mein Jahr der Veränderung!           ,['#depression'],Fick Dich 2018!  2019 wird mein Jahr der Veränderung!           #depression,1
1293,1079805402143956992,1079805402143956992,2018-12-31,healthibadan,"Don't die in silence, Talk to someone today about those issues bothering you .... kills faster than AIDS",['#depression'],"Don't die in silence, Talk to someone today about those issues bothering you ....#Depression kills faster than AIDS",1
1295,1079804078606172160,1079804078606172160,2018-12-31,qhuessin,He thinks I want to cuddle. I really want to just not be sad so I'm going to sleep... ,['#depression'],He thinks I want to cuddle. I really want to just not be sad so I'm going to sleep... #depression,1
1307,1079798159067492353,1079798153317109762,2018-12-31,muzzymusing,"So, ending out this year, I'm as physically active & healthy as I've been in years (yay boxing & yoga). I'm addressing/working on my  &  more than I ever have. Due to talking, my marriage is stronger than it's been in a long while. 5/","['#depression', '#anxiety']","So, ending out this year, I'm as physically active & healthy as I've been in years (yay boxing & yoga). I'm addressing/working on my #depression & #anxiety more than I ever have. Due to talking, my marriage is stronger than it's been in a long while. 5/",1
1319,1079794846368440330,1079794814726688770,2018-12-31,marycat1719,"6/ I didn’t always have this support. Not growing up. Not in the early years of my marriage. Not bc my family didn’t care, or bc Jay didn’t love me. BC  lies... it tells you no one will ever understand or accept the “real” you.",['#depression'],"6/ I didn’t always have this support. Not growing up. Not in the early years of my marriage. Not bc my family didn’t care, or bc Jay didn’t love me. BC #depression lies... it tells you no one will ever understand or accept the “real” you.",1
1338,1079789816097751041,1079789816097751041,2018-12-31,ss_final,Try to keep up with social activities even if you don’t feel like it. It'll help with ,['#depression'],Try to keep up with social activities even if you don’t feel like it. It'll help with #depression,1
1347,1079787028840095747,1079787028840095747,2018-12-31,lowerdepression,"No one realizes how strong someone with  has to be just to do daily stuff like shower, brush hair or get out of bed.",['#depression'],"No one realizes how strong someone with #depression has to be just to do daily stuff like shower, brush hair or get out of bed.",1
1354,1079785893341396995,1079785893341396995,2018-12-31,torie_sweetcake,Feel soo crappy right now. I'd love a chill night with a take away and a night lying in bed  ,"['#depression', '#anxiety']",Feel soo crappy right now. I'd love a chill night with a take away and a night lying in bed #depression #anxiety,1
1355,1079785851331272705,1079785851331272705,2018-12-31,ochoawriter,My new therapy for depression is working well. It’s called DTAS—Don’t Take Any Shit.   ,"['#depression', '#bipolar', '#bipolardisorder']",My new therapy for depression is working well. It’s called DTAS—Don’t Take Any Shit. #depression #bipolar #bipolardisorder,1
1365,1079784318757756929,1079784318757756929,2018-12-31,noemztar,"I feel alone even if I'm not alone😭😭😭
 attacks atm. Someone can help me?😩",['#depression'],"I feel alone even if I'm not alone😭😭😭
#depression attacks atm. Someone can help me?😩",1
1368,1079783405317955584,1079783405317955584,2018-12-31,leseratte82,"Ein echtes Kackjahr liegt hinter mir, in dem die  mir monatelang das Leben schwer gemacht hat. Aber ich blicke auch dankbar und stolz auf das Jahr zurück, denn ich habe mir Hilfe gesucht, neue Kraft geschöpft und kann mich nun auf 2019 freuen.  ","['#depression', '#mein2018', '#notjustsad']","Ein echtes Kackjahr liegt hinter mir, in dem die #Depression mir monatelang das Leben schwer gemacht hat. Aber ich blicke auch dankbar und stolz auf das Jahr zurück, denn ich habe mir Hilfe gesucht, neue Kraft geschöpft und kann mich nun auf 2019 freuen. #mein2018 #notjustsad",1
1384,1079779557203460097,1079779557203460097,2018-12-31,maryjoalva,I don’t believe in New Year’s resolutions BUT there IS one thing that I am making happen next year. I will be getting the fuck out of . I hate this state. I know moving won’t completely cure me from my  but I know it’ll definitely help.,"['#florida', '#depression']",I don’t believe in New Year’s resolutions BUT there IS one thing that I am making happen next year. I will be getting the fuck out of #Florida. I hate this state. I know moving won’t completely cure me from my #depression but I know it’ll definitely help.,1
1388,1079777974981935106,1079777974981935106,2018-12-31,justtellone,Start by setting small goals. Then keep the momentum going until you achieve something extraordinary.     pic.twitter.com/fIDmxmqixZ,"['#mondaymotivation', '#depression', '#addiction']",Start by setting small goals. Then keep the momentum going until you achieve something extraordinary.  #MondayMotivation #depression #addiction pic.twitter.com/fIDmxmqixZ,1
1396,1079776343997464577,1079776343997464577,2018-12-31,gareth19801,"Would just like to wish everyone happy New year and all the best for 2019, 2018 was a difficult start due to  and  but a fantastic end marrying the love of my life here's to a fantastic new year, oh and of course more  adventures pic.twitter.com/mwQWUX68xi","['#anxiety', '#depression', '#groundhopping']","Would just like to wish everyone happy New year and all the best for 2019, 2018 was a difficult start due to #anxiety and #depression but a fantastic end marrying the love of my life here's to a fantastic new year, oh and of course more #groundhopping adventures pic.twitter.com/mwQWUX68xi",1
1398,1079776051260256264,1079776051260256264,2018-12-31,terencehiller39,"2018 is almost over...Whatever. 🙄
I haven't had a good year in 3 f|CENSORED|ing years! 😡:
STILL UNEMPLOYED!!!
Unemployment sucks! It's like your whole life is suspended!
Everything is joyless, & you're just surviving w/ no hope that things will get better again. 😑 ",['#depression'],"2018 is almost over...Whatever. 🙄
I haven't had a good year in 3 f|CENSORED|ing years! 😡:
STILL UNEMPLOYED!!!
Unemployment sucks! It's like your whole life is suspended!
Everything is joyless, & you're just surviving w/ no hope that things will get better again. 😑 #Depression",1
1399,1079775654298570752,1079775654298570752,2018-12-31,bluegirlseeking,"This is it. 2019 *has* to be the year that I take control of my life. On the outside I look successful and happy, but on the inside I feel empty, lost, emotionless, unambitious and lazy. I procrastinate because I don't care about anything. Time to change.  ","['#anxiety', '#depression']","This is it. 2019 *has* to be the year that I take control of my life. On the outside I look successful and happy, but on the inside I feel empty, lost, emotionless, unambitious and lazy. I procrastinate because I don't care about anything. Time to change. #anxiety #depression",1
1418,1079769808281972738,1079769808281972738,2018-12-31,valariejward,"As someone who's been dealing with  and  nearly all my life, I have always hated inspirational quotes or advice that don't apply to people like me. ""Don't Worry, Be Happy""? Wow, why didn't I think of that? 🤦🏼‍♀️","['#anxiety', '#depression']","As someone who's been dealing with #anxiety and #depression nearly all my life, I have always hated inspirational quotes or advice that don't apply to people like me. ""Don't Worry, Be Happy""? Wow, why didn't I think of that? 🤦🏼‍♀️",1
1444,1079763183932452866,1079763183932452866,2018-12-31,kumba_sara,I hate having a speech impediment!  ,"['#depression', '#peoplearejerks']",I hate having a speech impediment! #depression #peoplearejerks,1
1446,1079762464739393537,1079761392138444801,2018-12-31,isalevin42," schmerzt, klar. Aber dass Silvester für mich so schlimm ist, liegt daran, dass ich ihn jahrelang mit meiner großen Liebe verbracht habe & das nicht mehr kann, weil der Mann, mit dem ich eine Zukunft geplant hatte, diese wegen  &  weggeworfen hat.","['#liebeskummer', '#depression', '#sucht']","#Liebeskummer schmerzt, klar. Aber dass Silvester für mich so schlimm ist, liegt daran, dass ich ihn jahrelang mit meiner großen Liebe verbracht habe & das nicht mehr kann, weil der Mann, mit dem ich eine Zukunft geplant hatte, diese wegen #Depression & #Sucht weggeworfen hat.",1
1454,1079759617213808641,1079759617213808641,2018-12-31,ss_final,"Socialize with positive people, it'll help with ",['#depression'],"Socialize with positive people, it'll help with #depression",1
1455,1079759593473888257,1079759593473888257,2018-12-31,cliffdimerandy," is a disease, it affects everybody no matter what your age is. I'm 36 but I've suffered from depression,   etc. Since I was a kid. It knows no age, race, it doesn't discriminate...we who suffer need to unite, I'm creating a website soon for depression. pic.twitter.com/o7fvyzkcV4","['#depression', '#anxiety', '#ptsd']","#depression is a disease, it affects everybody no matter what your age is. I'm 36 but I've suffered from depression, #anxiety #ptsd etc. Since I was a kid. It knows no age, race, it doesn't discriminate...we who suffer need to unite, I'm creating a website soon for depression. pic.twitter.com/o7fvyzkcV4",1
1468,1079754808112959488,1079754808112959488,2018-12-31,ninemuff,Ich hasse Silvester! Es macht mir Angst!!! Es triggert mich!!!  ,"['#notjustsad', '#depression']",Ich hasse Silvester! Es macht mir Angst!!! Es triggert mich!!! #notjustsad #depression,1
1470,1079754719571181569,1079754719571181569,2018-12-31,scapethought,My new years resolution is literally to try my best not to kill myself. How sad is that.   ,"['#newyearseve', '#depression', '#suicide']",My new years resolution is literally to try my best not to kill myself. How sad is that. #NewYearsEve #Depression #Suicide,1
1483,1079751740126306304,1079751740126306304,2018-12-31,theresasaylor,Tired of holding it all together over the holidays. I’m ready to just fall apart now.  Heading to therapy now. A safe place do do just that.   ,"['#depression', '#anxiety']",Tired of holding it all together over the holidays. I’m ready to just fall apart now.  Heading to therapy now. A safe place do do just that.  #depression #anxiety,1
1498,1079744748879892481,1079744748879892481,2018-12-31,rishik_raiden,"Do you remember how strong you stood when you were mentally stressed out or perhaps depressed of certain outcomes with the big smile on your face? Well, practically the suffering won't probably end with a new year, so it's time to face 2k19 the same way. 

 ","['#bye2018', '#depression']","Do you remember how strong you stood when you were mentally stressed out or perhaps depressed of certain outcomes with the big smile on your face? Well, practically the suffering won't probably end with a new year, so it's time to face 2k19 the same way. 

#Bye2018 #Depression",1
1500,1079743571299848192,1079743571299848192,2018-12-31,jesselongshot,"Feel extremely depressed! Ineed someone tohold me and a literal shoulder to cry on, but i always weep alone! Nobody loves me or cares! Perpetual loneliness proves it beyond a shadow of a doubt! ",['#depression'],"Feel extremely depressed! Ineed someone tohold me and a literal shoulder to cry on, but i always weep alone! Nobody loves me or cares! Perpetual loneliness proves it beyond a shadow of a doubt! #depression",1
1506,1079740641972707329,1079740641972707329,2018-12-31,reedahmad5,"Almost New Year here in Eastern Region.
Even I'm new to this Twitter, I just wanna say, thank you so much for your love and support. I really do.
And I hope that I don't get a lot of pressure and depression too much... 
Please... Help me... I can't do this alone...

",['#depression'],"Almost New Year here in Eastern Region.
Even I'm new to this Twitter, I just wanna say, thank you so much for your love and support. I really do.
And I hope that I don't get a lot of pressure and depression too much... 
Please... Help me... I can't do this alone...

#depression",1
1507,1079740445201256448,1079740445201256448,2018-12-31,jesselongshot,Another lonely New Years Eve with nobody to talk to. La historia de mi vida. God knows i need somebody! ,['#depression'],Another lonely New Years Eve with nobody to talk to. La historia de mi vida. God knows i need somebody! #depression,1
1523,1079736968408428545,1079736968408428545,2018-12-31,ss_final,Exercise is a powerful tool for dealing with ,['#depression'],Exercise is a powerful tool for dealing with #depression,1
1545,1079727670441713665,1079727670441713665,2018-12-31,ss_final," is only temporary, you can get passed this!",['#depression'],"#Depression is only temporary, you can get passed this!",1
1551,1079726263470833669,1079726263470833669,2018-12-31,notdeadyetft,"Good things that happened in 2018:
1. Diagnosed with 
2. Started meds
3. Had a stable very good start to this academic year noted by manager and seniors 🙂
4. Found myself coming out of  which had crippled me 
5. Generally happier! 

What about you guys?","['#bipolar', '#depression']","Good things that happened in 2018:
1. Diagnosed with #bipolar
2. Started meds
3. Had a stable very good start to this academic year noted by manager and seniors 🙂
4. Found myself coming out of #depression which had crippled me 
5. Generally happier! 

What about you guys?",1
1562,1079724003923763200,1079724003923763200,2018-12-31,ss_final,"""Anger is energizing. The opposite of anger is depression, which is anger turned inward.""   ","['#whatyoudontsee', '#depression', '#depressionawarenessweek']","""Anger is energizing. The opposite of anger is depression, which is anger turned inward."" #whatyoudontsee #depression #depressionawarenessweek",1
1565,1079722757083021312,1079722757083021312,2018-12-31,antdaboss214,I honestly don’t know why people think it’s a trend to say “I’m depressed” when in reality depression is nothing to joke about...  ,"['#justsaying', '#depression']",I honestly don’t know why people think it’s a trend to say “I’m depressed” when in reality depression is nothing to joke about... #JustSaying #Depression,1
1567,1079721979614253057,1079721979614253057,2018-12-31,webdev77,"God knows every flaw, every habit, every mistake, and is still deeply in love with you. Let that sink all the way in.    pic.twitter.com/7mbNnd7D33","['#depression', '#suicide', '#pray']","God knows every flaw, every habit, every mistake, and is still deeply in love with you. Let that sink all the way in. #depression #suicide #pray pic.twitter.com/7mbNnd7D33",1
1575,1079716567900811265,1079716567900811265,2018-12-31,eliseee194,"To those who struggled through NYE like me please try and think about something positive you want to achieve next year. Focus on the future. If you have no idea feel free to message me, I’m happy to chat   ","['#depression', '#anxiety', '#loneliness']","To those who struggled through NYE like me please try and think about something positive you want to achieve next year. Focus on the future. If you have no idea feel free to message me, I’m happy to chat #depression #anxiety #loneliness",1
1598,1079708146506043392,1079708146506043392,2018-12-31,vsnaire,I don’t mean to drop in if we haven’t spoken in awhile. I’m trying to make myself better and learn from old friends so I can be better for them and for me. it’s a constant struggle justifying my importance to myself and to others. ,['#depression'],I don’t mean to drop in if we haven’t spoken in awhile. I’m trying to make myself better and learn from old friends so I can be better for them and for me. it’s a constant struggle justifying my importance to myself and to others. #depression,1
1603,1079706940257849345,1079706940257849345,2018-12-31,erstekatze,"
Ich hab so Angst vor einem Rückfall. Wenn ich nicht funktioniere, bricht meine kleine Familie zusammen.",['#depression'],"#Depression
Ich hab so Angst vor einem Rückfall. Wenn ich nicht funktioniere, bricht meine kleine Familie zusammen.",1
1606,1079706227238715397,1079706223849730048,2018-12-31,claire_lee,"It was also a year laced through with an almost constant struggle against chronic  and its effects, exacerbated by the medication I take for .","['#depression', '#bipolardisorder']","It was also a year laced through with an almost constant struggle against chronic #depression and its effects, exacerbated by the medication I take for #bipolardisorder.",1
1609,1079705460494749701,1079705460494749701,2018-12-31,nandrew7,You had a couple of good months but I basically kicked your Arse in 2018. And will beat you more in 2019. Thnx for everyone that constantly helps me xx   pic.twitter.com/nZgj476kk9,['#depression'],You had a couple of good months but I basically kicked your Arse in 2018. And will beat you more in 2019. Thnx for everyone that constantly helps me xx #depression  pic.twitter.com/nZgj476kk9,1
1613,1079703882522132480,1079703882522132480,2018-12-31,caffgarden,"Don't feel the best again today. Trying to get moving and haven't done anything yet. House needs doing, hens cleaning out and dogs taking out. A shower first on the list and shopping for this evening. christmas and New year always hard work for me.  ","['#depression', '#depressionisreal']","Don't feel the best again today. Trying to get moving and haven't done anything yet. House needs doing, hens cleaning out and dogs taking out. A shower first on the list and shopping for this evening. christmas and New year always hard work for me. #depression #DepressionIsReal",1
1614,1079703826280656897,1079703826280656897,2018-12-31,guernseyhypno,When we take steps to self empowerment we can change our world   .,"['#anxiety', '#depression', '#theenergyofanxiety']",When we take steps to self empowerment we can change our world #anxiety #depression #theenergyofanxiety.,1
1616,1079703355839131649,1079703355839131649,2018-12-31,estelastar6,"Why don't you listen to me? Why don't you hear me? Why won't you try to understand? Why I'm tired you ask? AH, look in the mirror. 😢",['#depression'],"Why don't you listen to me? Why don't you hear me? Why won't you try to understand? Why I'm tired you ask? AH, look in the mirror. 😢#depression",1
1633,1079696304572452864,1079673233648091136,2018-12-31,stefan1970m,"Und jetzt doch Oper (18:00 Uhbr bis 21:00 Uhr)......ich freue mich sehr.....ich habe Riesenangst.....ich freue mich....ich habe Angst....ach, Ruhe - innere Stimmen......
",['#depression'],"Und jetzt doch Oper (18:00 Uhbr bis 21:00 Uhr)......ich freue mich sehr.....ich habe Riesenangst.....ich freue mich....ich habe Angst....ach, Ruhe - innere Stimmen......
#Depression",1
1637,1079694344842629120,1079694344842629120,2018-12-31,deprifrei,"2018 geht zu Ende & das Arschloch  will mir noch einmal richtig den Stinkefinger zeigen. Ich habe die Vermutung, dass die schwarze Dame mit mir ins Neue Jahr rutschen wird. Sie ist super treu & immer für mich da, damit meine Laune unten bleibt.

 ","['#depression', '#silvester', '#notjustsad']","2018 geht zu Ende & das Arschloch #Depression will mir noch einmal richtig den Stinkefinger zeigen. Ich habe die Vermutung, dass die schwarze Dame mit mir ins Neue Jahr rutschen wird. Sie ist super treu & immer für mich da, damit meine Laune unten bleibt.

#Silvester #notjustsad",1
1639,1079692867508015104,1079692867508015104,2018-12-31,deprifrei,"Ich habe mit meiner  gesprochen & fühle mich noch depressiver. Wegen meiner  fühle ich mich von ihr nicht verstanden, obwohl sie zur Zeit selbst depressiv ist. Von der einstigen Powerfrau ist am Ende des Jahres nix zu sehen. In der  kaputt gearbeitet.😭","['#mama', '#depression', '#pflege']","Ich habe mit meiner #Mama gesprochen & fühle mich noch depressiver. Wegen meiner #Depression fühle ich mich von ihr nicht verstanden, obwohl sie zur Zeit selbst depressiv ist. Von der einstigen Powerfrau ist am Ende des Jahres nix zu sehen. In der #Pflege kaputt gearbeitet.😭",1
1642,1079691670483099648,1079691670483099648,2018-12-31,ss_final,Turn to friends and family members who make you feel loved and cared for. Stop ,['#depression'],Turn to friends and family members who make you feel loved and cared for. Stop #depression,1
1648,1079686760672755713,1079686760672755713,2018-12-31,recoveryletters,"I tend to ignore new year and all its resolutions that are too easy to break & then you feel worse about yourself.

Try new things any time, with gusto and commitment but don't punish yourself if it doesn't work, there are more tools in the box


","['#depression', '#depressionrecovery']","I tend to ignore new year and all its resolutions that are too easy to break & then you feel worse about yourself.

Try new things any time, with gusto and commitment but don't punish yourself if it doesn't work, there are more tools in the box

#depression
#depressionrecovery",1
1651,1079685138483691525,1079685138483691525,2018-12-31,puppytude,"Look, I'm fine. But when I've been down to my last shred of hope, most of the people who would have acted shocked if I'd come to a bad end, ignored my emails/txts. They weren't ""emergency"" texts. Just ""How's it going?"", but them ignoring it made me feel .   ","['#alone', '#depression', '#bpd']","Look, I'm fine. But when I've been down to my last shred of hope, most of the people who would have acted shocked if I'd come to a bad end, ignored my emails/txts. They weren't ""emergency"" texts. Just ""How's it going?"", but them ignoring it made me feel #alone.  #Depression #BPD",1
1667,1079681335436939269,1079681335436939269,2018-12-31,findingmyvoice2,"Wow I feel like I am a bomb waiting to go off. Feeling so angry. 

Why does  do this! I just want to feel ok.",['#depression'],"Wow I feel like I am a bomb waiting to go off. Feeling so angry. 

Why does #Depression do this! I just want to feel ok.",1
1668,1079681282517467136,1079681282517467136,2018-12-31,sonofdavies_,"To those of us that survived our own  thoughts this year THINKING its , we're grateful we didn't take what does not belong to us - ","['#suicidal', '#depression', '#life']","To those of us that survived our own #SUICIDAL thoughts this year THINKING its #DEPRESSION, we're grateful we didn't take what does not belong to us - #LIFE",1
1675,1079676570518908928,1079676570518908928,2018-12-31,ss_final, is a condition which will affect an estimated one in five of the population at some point in their lives,['#depression'],#depression is a condition which will affect an estimated one in five of the population at some point in their lives,1
1677,1079676323172442113,1079676323172442113,2018-12-31,dr_s_i_khan," will be 2nd leading cause of death in 2020 
~WHO.",['#depression'],"#Depression will be 2nd leading cause of death in 2020 
~WHO.",1
1682,1079673233648091136,1079673233648091136,2018-12-31,stefan1970m,Die Unfähigkeit Silvester zu planen und zu feiern als Teil der Krankheit zu akzeptieren ist schwer.....jetzt ist Selbstfürsorge angesagt...kann ich ja gut....,['#depression'],Die Unfähigkeit Silvester zu planen und zu feiern als Teil der Krankheit zu akzeptieren ist schwer.....jetzt ist Selbstfürsorge angesagt...kann ich ja gut....#Depression,1
1685,1079671147808067584,1079671147808067584,2018-12-31,thefaiidat,"Unpopular opinion: Muslim parents are more strict on their female children than Christian parents. They are too over-protective of them which in turn leaves them depressed as a result of not being allowed to go out and not being allowed to make new friends.
",['#depression'],"Unpopular opinion: Muslim parents are more strict on their female children than Christian parents. They are too over-protective of them which in turn leaves them depressed as a result of not being allowed to go out and not being allowed to make new friends.
#depression",1
1700,1079664686595944448,1079664686595944448,2018-12-31,jwande77,"If I die tonight will it extinguish a light or will it raise hope for a someone else? It might do both n that's my hope.

  ","['#depression', '#rap', '#lyrics']","If I die tonight will it extinguish a light or will it raise hope for a someone else? It might do both n that's my hope.

#depression #rap #lyrics",1
